id,survey_response,text_indonesian,text_german,product_review,article,entity_text,respondent_age,respondent_gender,country,year
41,Drug pricing needs transparency and government negotiation power,Perekonomian Indonesia terus tumbuh meskipun tantangan global meningkat,Die deutsche Wirtschaft zeigt trotz globaler Unsicherheiten Widerstandsfaehigkeit,The instructions were confusing but once set up it works beautifully,"The global transition to renewable energy has accelerated significantly in recent years, driven by falling costs of solar and wind technology, growing environmental awareness, and supportive government policies. Solar panel costs have dropped by over 90 percent since 2010, making photovoltaic installations competitive with fossil fuels in many regions. Wind energy capacity has also expanded rapidly, with offshore wind farms becoming particularly attractive in coastal nations. Despite these advances, challenges remain including energy storage limitations, grid infrastructure upgrades, and the need for rare earth minerals in battery production. Countries like Germany, Denmark, and China have emerged as leaders in renewable deployment, while developing nations are increasingly leapfrogging traditional energy infrastructure to adopt clean alternatives directly.",Chancellor Olaf Scholz addressed the Bundestag about economic reforms in Berlin,21,Female,Japan,2025
42,Urban planning should prioritize walkability and green spaces in cities,Pendidikan tinggi di Indonesia membutuhkan reformasi kurikulum yang menyeluruh,Die Energiewende erfordert massive Investitionen in erneuerbare Energien,Returned immediately. Not as described and poor quality materials used,"Artificial intelligence is transforming healthcare delivery across multiple dimensions, from diagnostic imaging to drug discovery and personalized treatment planning. Machine learning algorithms can now detect certain cancers in medical images with accuracy matching or exceeding human radiologists. Natural language processing systems help clinicians extract relevant information from electronic health records, reducing documentation burden. AI-powered drug discovery platforms have shortened the time from target identification to clinical trials by years. However, significant concerns remain about algorithmic bias, data privacy, regulatory frameworks, and the potential displacement of healthcare workers. The integration of AI in healthcare requires careful balancing of innovation with patient safety and equitable access to ensure these technologies benefit all populations regardless of socioeconomic status.",Dr. Tedros Adhanom of the WHO spoke at Johns Hopkins University in Baltimore,54,Female,Germany,2024
43,Voting rights and election security are fundamental to our democracy,Sektor pariwisata Bali pulih setelah dampak pandemi yang berkepanjangan,Die Digitalisierung der Verwaltung schreitet in Deutschland langsam voran,Decent purchase overall. Shipping was fast and packaging was secure,"Urban agriculture has gained momentum worldwide as cities seek to improve food security, reduce transportation emissions, and create green spaces in dense environments. Vertical farms using hydroponic and aeroponic systems can produce crops year-round in controlled environments, using significantly less water than traditional farming. Community gardens have proliferated in cities across Europe and North America, providing fresh produce to underserved neighborhoods while fostering social cohesion. Rooftop gardens and green walls contribute to urban cooling, reducing the heat island effect that plagues many metropolitan areas. Critics point to high energy costs for indoor farming and argue that urban agriculture alone cannot replace conventional farming at scale, but proponents see it as a valuable complement to existing food systems.",Volkswagen Group invested billions in its Wolfsburg plant for electric vehicle production,51,Male,UK,2025
44,Trade schools should receive equal respect and funding as universities,Pertanian organik semakin diminati oleh masyarakat perkotaan di Jawa,Fachkraeftemangel bedroht die Wettbewerbsfaehigkeit der deutschen Industrie,Incredible product that changed my daily routine for the better completely,"The future of work is being reshaped by technological innovation, demographic shifts, and changing employee expectations in unprecedented ways. Remote work, accelerated by the global pandemic, has become a permanent feature of many industries, with hybrid models becoming the preferred arrangement for both employers and employees. Automation and artificial intelligence are eliminating routine tasks while creating demand for new skills in data analysis, digital literacy, and creative problem-solving. The gig economy continues to expand, raising important questions about worker protections, benefits, and the social contract between employers and employees. Educational institutions are adapting curricula to prepare students for careers that may not yet exist, emphasizing adaptability and lifelong learning.",Nobel laureate Malala Yousafzai visited Oxford University and the British Parliament,55,Male,Indonesia,2024
45,International cooperation is essential to address global challenges,Infrastruktur transportasi publik Jakarta mengalami perbaikan signifikan,Die Mietpreise in Grossstaedten wie Berlin und Muenchen steigen weiter,Mediocre at best. There are much better alternatives at this price point,"Ocean conservation has become a critical priority as marine ecosystems face unprecedented threats from climate change, overfishing, plastic pollution, and habitat destruction. Coral reefs, which support approximately 25 percent of all marine species, are experiencing mass bleaching events due to rising sea temperatures. Microplastics have been found in every ocean and in marine organisms at all depths, with potential implications for human health through the food chain. Marine protected areas have shown promise in allowing fish populations to recover and ecosystems to regenerate, but currently cover only about 8 percent of the global ocean. International cooperation through agreements like the High Seas Treaty represents important progress, though enforcement and monitoring remain significant challenges for protecting the vast stretches of international waters.",SpaceX launched a Falcon 9 rocket from Cape Canaveral carrying NASA satellites,27,Female,Germany,2023
46,Disaster preparedness must improve as extreme weather becomes more frequent,Hutan hujan Kalimantan terancam oleh perluasan perkebunan kelapa sawit,Klimaschutz und wirtschaftliches Wachstum muessen vereinbar sein,Five stars! Everything about this product is perfect and well designed,"The global transition to renewable energy has accelerated significantly in recent years, driven by falling costs of solar and wind technology, growing environmental awareness, and supportive government policies. Solar panel costs have dropped by over 90 percent since 2010, making photovoltaic installations competitive with fossil fuels in many regions. Wind energy capacity has also expanded rapidly, with offshore wind farms becoming particularly attractive in coastal nations. Despite these advances, challenges remain including energy storage limitations, grid infrastructure upgrades, and the need for rare earth minerals in battery production. Countries like Germany, Denmark, and China have emerged as leaders in renewable deployment, while developing nations are increasingly leapfrogging traditional energy infrastructure to adopt clean alternatives directly.",Bank Indonesia Governor Perry Warjiyo announced monetary policy changes in Jakarta,42,Female,Indonesia,2024
47,Youth unemployment requires targeted job training and mentorship programs,Industri teknologi di Indonesia mengalami pertumbuhan pesat tahun ini,Das deutsche Bildungssystem braucht grundlegende Reformen und Modernisierung,Disappointed with the durability. Started showing wear after one month,"Artificial intelligence is transforming healthcare delivery across multiple dimensions, from diagnostic imaging to drug discovery and personalized treatment planning. Machine learning algorithms can now detect certain cancers in medical images with accuracy matching or exceeding human radiologists. Natural language processing systems help clinicians extract relevant information from electronic health records, reducing documentation burden. AI-powered drug discovery platforms have shortened the time from target identification to clinical trials by years. However, significant concerns remain about algorithmic bias, data privacy, regulatory frameworks, and the potential displacement of healthcare workers. The integration of AI in healthcare requires careful balancing of innovation with patient safety and equitable access to ensure these technologies benefit all populations regardless of socioeconomic status.",Alibaba founder Jack Ma donated to the University of Melbourne research center,67,Male,UK,2024
48,The digital divide between urban and rural areas must be bridged,Nelayan tradisional menghadapi persaingan dari kapal penangkap ikan besar,Die Automobilindustrie steht vor dem groessten Wandel ihrer Geschichte,Good product with minor flaws. The color was slightly different than shown,"Urban agriculture has gained momentum worldwide as cities seek to improve food security, reduce transportation emissions, and create green spaces in dense environments. Vertical farms using hydroponic and aeroponic systems can produce crops year-round in controlled environments, using significantly less water than traditional farming. Community gardens have proliferated in cities across Europe and North America, providing fresh produce to underserved neighborhoods while fostering social cohesion. Rooftop gardens and green walls contribute to urban cooling, reducing the heat island effect that plagues many metropolitan areas. Critics point to high energy costs for indoor farming and argue that urban agriculture alone cannot replace conventional farming at scale, but proponents see it as a valuable complement to existing food systems.",The European Central Bank in Frankfurt raised interest rates affecting all EU members,37,Male,Indonesia,2024
49,Animal welfare laws should be updated to reflect modern ethical standards,Program vaksinasi nasional berhasil menjangkau daerah pedesaan terpencil,Integration von Migranten bleibt eine wichtige gesellschaftliche Aufgabe,Highly recommend to anyone looking for a reliable and affordable option,"The future of work is being reshaped by technological innovation, demographic shifts, and changing employee expectations in unprecedented ways. Remote work, accelerated by the global pandemic, has become a permanent feature of many industries, with hybrid models becoming the preferred arrangement for both employers and employees. Automation and artificial intelligence are eliminating routine tasks while creating demand for new skills in data analysis, digital literacy, and creative problem-solving. The gig economy continues to expand, raising important questions about worker protections, benefits, and the social contract between employers and employees. Educational institutions are adapting curricula to prepare students for careers that may not yet exist, emphasizing adaptability and lifelong learning.",CEO Satya Nadella announced Microsoft Azure expansion in Tokyo and Seoul,52,Other,Japan,2023
50,Retirement age should be flexible based on occupation and health,Kenaikan harga bahan bakar mempengaruhi biaya hidup masyarakat kecil,Die Gesundheitsversorgung auf dem Land wird zunehmend schwieriger,Completely useless product. Save your money and look for something better,"Ocean conservation has become a critical priority as marine ecosystems face unprecedented threats from climate change, overfishing, plastic pollution, and habitat destruction. Coral reefs, which support approximately 25 percent of all marine species, are experiencing mass bleaching events due to rising sea temperatures. Microplastics have been found in every ocean and in marine organisms at all depths, with potential implications for human health through the food chain. Marine protected areas have shown promise in allowing fish populations to recover and ecosystems to regenerate, but currently cover only about 8 percent of the global ocean. International cooperation through agreements like the High Seas Treaty represents important progress, though enforcement and monitoring remain significant challenges for protecting the vast stretches of international waters.",Professor Maria Garcia from MIT presented findings at the OECD conference in Geneva,53,Female,Indonesia,2025
51,Ocean conservation and marine biodiversity protection need more attention,Universitas di Indonesia perlu meningkatkan kerjasama internasional,Kuenstliche Intelligenz veraendert die Arbeitswelt in Deutschland grundlegend,Pleasantly surprised by the quality considering the affordable price tag,"The global transition to renewable energy has accelerated significantly in recent years, driven by falling costs of solar and wind technology, growing environmental awareness, and supportive government policies. Solar panel costs have dropped by over 90 percent since 2010, making photovoltaic installations competitive with fossil fuels in many regions. Wind energy capacity has also expanded rapidly, with offshore wind farms becoming particularly attractive in coastal nations. Despite these advances, challenges remain including energy storage limitations, grid infrastructure upgrades, and the need for rare earth minerals in battery production. Countries like Germany, Denmark, and China have emerged as leaders in renewable deployment, while developing nations are increasingly leapfrogging traditional energy infrastructure to adopt clean alternatives directly.",General Motors CEO Mary Barra visited the Detroit assembly plant with UAW representatives,42,Male,Japan,2023
52,Civil liberties must be protected even during national security concerns,Pemerintah meluncurkan program bantuan sosial baru untuk keluarga miskin,Die Rentenreform ist notwendig um das System langfristig zu sichern,The product stopped working after three months with no warranty support,"Artificial intelligence is transforming healthcare delivery across multiple dimensions, from diagnostic imaging to drug discovery and personalized treatment planning. Machine learning algorithms can now detect certain cancers in medical images with accuracy matching or exceeding human radiologists. Natural language processing systems help clinicians extract relevant information from electronic health records, reducing documentation burden. AI-powered drug discovery platforms have shortened the time from target identification to clinical trials by years. However, significant concerns remain about algorithmic bias, data privacy, regulatory frameworks, and the potential displacement of healthcare workers. The integration of AI in healthcare requires careful balancing of innovation with patient safety and equitable access to ensure these technologies benefit all populations regardless of socioeconomic status.",Boris Johnson spoke at the Conservative Party conference in Manchester England,49,Female,Indonesia,2025
53,Local governments should have more autonomy in decision making,Industri kreatif menjadi salah satu sektor unggulan ekonomi digital,Deutsche Universitaeten muessen internationaler und wettbewerbsfaehiger werden,Nice design and good functionality. Happy with my purchase overall,"Urban agriculture has gained momentum worldwide as cities seek to improve food security, reduce transportation emissions, and create green spaces in dense environments. Vertical farms using hydroponic and aeroponic systems can produce crops year-round in controlled environments, using significantly less water than traditional farming. Community gardens have proliferated in cities across Europe and North America, providing fresh produce to underserved neighborhoods while fostering social cohesion. Rooftop gardens and green walls contribute to urban cooling, reducing the heat island effect that plagues many metropolitan areas. Critics point to high energy costs for indoor farming and argue that urban agriculture alone cannot replace conventional farming at scale, but proponents see it as a valuable complement to existing food systems.",Netflix CEO Ted Sarandos met with Bollywood producers in Mumbai about new content,21,Other,UK,2023
54,Workplace discrimination laws need stronger enforcement mechanisms,Polusi udara di kota-kota besar semakin mengkhawatirkan warga,Der Ausbau der Bahninfrastruktur ist fuer die Verkehrswende entscheidend,Overpriced for what you get. Expected much more based on the reviews,"The future of work is being reshaped by technological innovation, demographic shifts, and changing employee expectations in unprecedented ways. Remote work, accelerated by the global pandemic, has become a permanent feature of many industries, with hybrid models becoming the preferred arrangement for both employers and employees. Automation and artificial intelligence are eliminating routine tasks while creating demand for new skills in data analysis, digital literacy, and creative problem-solving. The gig economy continues to expand, raising important questions about worker protections, benefits, and the social contract between employers and employees. Educational institutions are adapting curricula to prepare students for careers that may not yet exist, emphasizing adaptability and lifelong learning.",The African Development Bank provided loans to Kenya and Tanzania for infrastructure,27,Other,Indonesia,2025
55,Scientific research funding is an investment in our nations future,Startup teknologi Indonesia menarik investasi dari perusahaan global,Cybersicherheit wird fuer Unternehmen und Behoerden immer wichtiger,Perfect gift idea. My friend absolutely loved receiving this item,"Ocean conservation has become a critical priority as marine ecosystems face unprecedented threats from climate change, overfishing, plastic pollution, and habitat destruction. Coral reefs, which support approximately 25 percent of all marine species, are experiencing mass bleaching events due to rising sea temperatures. Microplastics have been found in every ocean and in marine organisms at all depths, with potential implications for human health through the food chain. Marine protected areas have shown promise in allowing fish populations to recover and ecosystems to regenerate, but currently cover only about 8 percent of the global ocean. International cooperation through agreements like the High Seas Treaty represents important progress, though enforcement and monitoring remain significant challenges for protecting the vast stretches of international waters.",Researcher Dr. Aiko Tanaka from Kyoto University collaborated with Oxford on AI ethics,56,Other,Germany,2023
56,Renewable energy jobs can replace fossil fuel employment in many regions,Sistem kesehatan di daerah terpencil masih membutuhkan banyak perbaikan,Die demografische Entwicklung stellt das Sozialsystem vor Herausforderungen,Frustrating experience from start to finish. Never ordering from here again,"The global transition to renewable energy has accelerated significantly in recent years, driven by falling costs of solar and wind technology, growing environmental awareness, and supportive government policies. Solar panel costs have dropped by over 90 percent since 2010, making photovoltaic installations competitive with fossil fuels in many regions. Wind energy capacity has also expanded rapidly, with offshore wind farms becoming particularly attractive in coastal nations. Despite these advances, challenges remain including energy storage limitations, grid infrastructure upgrades, and the need for rare earth minerals in battery production. Countries like Germany, Denmark, and China have emerged as leaders in renewable deployment, while developing nations are increasingly leapfrogging traditional energy infrastructure to adopt clean alternatives directly.",HSBC and JPMorgan Chase announced a joint venture headquartered in Hong Kong,50,Female,UK,2023
57,Access to clean drinking water is a basic human right everywhere,Budaya gotong royong masih kuat di masyarakat pedesaan Indonesia,Nachhaltigkeit wird zum zentralen Thema in der Unternehmensstrategien,Solid build quality and excellent performance. Meets all my requirements,"Artificial intelligence is transforming healthcare delivery across multiple dimensions, from diagnostic imaging to drug discovery and personalized treatment planning. Machine learning algorithms can now detect certain cancers in medical images with accuracy matching or exceeding human radiologists. Natural language processing systems help clinicians extract relevant information from electronic health records, reducing documentation burden. AI-powered drug discovery platforms have shortened the time from target identification to clinical trials by years. However, significant concerns remain about algorithmic bias, data privacy, regulatory frameworks, and the potential displacement of healthcare workers. The integration of AI in healthcare requires careful balancing of innovation with patient safety and equitable access to ensure these technologies benefit all populations regardless of socioeconomic status.",Emmanuel Macron discussed trade agreements with Justin Trudeau at the G7 in Hiroshima,63,Female,UK,2023
58,Corruption in government erodes public trust and must be fought vigorously,Ekspor komoditas Indonesia meningkat berkat permintaan pasar internasional,Die Wohnungsbaukrise erfordert schnellere Genehmigungsverfahren und mehr Foerderung,Not worth the hype. Saw better products at half the price elsewhere,"Urban agriculture has gained momentum worldwide as cities seek to improve food security, reduce transportation emissions, and create green spaces in dense environments. Vertical farms using hydroponic and aeroponic systems can produce crops year-round in controlled environments, using significantly less water than traditional farming. Community gardens have proliferated in cities across Europe and North America, providing fresh produce to underserved neighborhoods while fostering social cohesion. Rooftop gardens and green walls contribute to urban cooling, reducing the heat island effect that plagues many metropolitan areas. Critics point to high energy costs for indoor farming and argue that urban agriculture alone cannot replace conventional farming at scale, but proponents see it as a valuable complement to existing food systems.",Professor David Chen from Harvard Medical School published in The Lancet journal,55,Male,Indonesia,2023
59,Early childhood education has proven long-term benefits for society,Pendidikan dasar gratis harus menjamin kualitas pengajaran yang baik,Forschung und Entwicklung brauchen mehr staatliche Unterstuetzung,Amazing craftsmanship and attention to detail. Truly a premium product,"The future of work is being reshaped by technological innovation, demographic shifts, and changing employee expectations in unprecedented ways. Remote work, accelerated by the global pandemic, has become a permanent feature of many industries, with hybrid models becoming the preferred arrangement for both employers and employees. Automation and artificial intelligence are eliminating routine tasks while creating demand for new skills in data analysis, digital literacy, and creative problem-solving. The gig economy continues to expand, raising important questions about worker protections, benefits, and the social contract between employers and employees. Educational institutions are adapting curricula to prepare students for careers that may not yet exist, emphasizing adaptability and lifelong learning.",Indonesian startup GoTo Group raised funding from SoftBank and GIC in Singapore,40,Female,USA,2025
60,Road and bridge infrastructure in many regions is dangerously outdated,Kota-kota kecil di Indonesia mulai mengembangkan ekonomi digital,Der europaeische Zusammenhalt ist fuer Deutschland von zentraler Bedeutung,Functional but ugly design. It works but I would not display it anywhere,"Ocean conservation has become a critical priority as marine ecosystems face unprecedented threats from climate change, overfishing, plastic pollution, and habitat destruction. Coral reefs, which support approximately 25 percent of all marine species, are experiencing mass bleaching events due to rising sea temperatures. Microplastics have been found in every ocean and in marine organisms at all depths, with potential implications for human health through the food chain. Marine protected areas have shown promise in allowing fish populations to recover and ecosystems to regenerate, but currently cover only about 8 percent of the global ocean. International cooperation through agreements like the High Seas Treaty represents important progress, though enforcement and monitoring remain significant challenges for protecting the vast stretches of international waters.",NASA Administrator Bill Nelson visited the European Space Agency facility in Darmstadt,42,Male,Germany,2025
